id,title_norm,label_1
1953,کارشناس دام,2
1954,کارشناس الکترونیک برق,2
1955,مکانیک ماشین آلات صنعتی درجه 3,7
1956,کارگر انبار مواد اولیه و قطعات,9
1957,کاردان بیمه وبازنشستگی,3
1958,مسئول پرس های ضربه ای و هیدرولیک,8
1959,مکانیک درجه وماشین الات,7
1960,متخصص تاسیسات,7
1961,مدیر خدمات طراحی,1
1962,مسئول دفتر مدیر طراحی بدنه,4
1963,مدیرکل دفترهییت مدیره ومدیرعامل,1
1964,کارشناس مسئول آرشیو فنی,2
1965,مدیریت دامداری,1
1966,مهندس ارشد نت برق کارگاه,2
1967,مهندس نت تجهیزات دوار,2
1968,کارگر حفاری جهت دار,8
1969,اپراتور نسوزکاری,8
1970,اپراتور پست برق و نیروگاه,8
1971,اپراتورارشد تولیدنوار,8
1972,رئیس ایمنی حمل و نقل,1
1973,رئیس بازرسی و برنامه ریزی نت,1
1974,سرپرست امور حقوقی و پیمانها,1
1975,سرپرست ایمنی فنی و فرآیندها,3
1976,مدیریت دفتر کل دادسرای نظامی,1
1977,کارگر کفش دوز با دست,7
1978,منشی و ماشین نویس دو,4
1979,کارمند خدمات عمومی,4
1980,استادکاریک کاربری ق,7
1981,برداشت کار لمینیت اتوماتیک,8
1982,برق ـ الکترونیک,7
1983,تکنسین ساختمان,3
1984,رئیس دایره درجه 1 ارزی,1
1985,سرپرست رسیدگی و ممیزی اسناد,3
1986,رئیس اداره رنگ سالن,1
1987,تکنسین ارشد تعمیرات شیرآلات و دستگاههای ثابت,3
1988,تکنسین ارشدازمایشگاه,3
1989,راننده کامیون حمل و نقل و جابه جایی شن و ماسه,8
1990,راننده کرین هوائی درگالوانیزه,8
1991,ریسندگی کارگر حمل کلاف نیمتاب,9
1992,سرپرست خطوط فرعی zone مونتاژ گیربکس تیبا,3
1993,متصدی اموال,4
1994,متصدی اموردفتری حالت اشتغال,4
1995,کارگر قراردادی بخش اکریلیک,8
1996,مسیول دفتر فنی ارتباطات تحقیقات,2
1997,متصدی خط لعاب,8
1998,مسئول سالن بسته بندی استریل,3
1999,متصدی پرس اکستروژن,8
2000,متصدی دستگاه برش موکت,8
2001,کارشناس کاهش خطر در بلایا و حوادث,2
2002,کارگردرجه یک کاردینگ ریسندگی,8
2003,کارگر تولید خشکبار دستی,7
2004,کارگر عمومی تعمیرات,9
2005,دبیر راهنمایی امام رضا,2
2006,تکنسین مکانیکی شاول ودریل,3
2007,رئیس شعبه دوم حسابرسی,1
2008,رییس تصفیه اب و پساب,1
2009,سرپرست تولید خطوط نهایی,3
2010,سرپرست جوشکاری واهنگری ونوسازی,3
2011,سرپرست حسابداری سرمایه گذاری ومشارکتها,2
2012,اپراتور دستگاه خط تولید باتری,8
2013,کنترل کیفیت متراژ بافندگی,3
2014,باسکول دار حراست,4
2015,تعمیرکاردرجه سه کارتن سازی,7
2016,برقکار واحد,7
2017,خشک کن رنگرزی,8
2018,سرپرست بهره برداری ماشین آلات فولادسازی,3
2019,راننده جرثقیل هوایی کوره های ذوب,8
2020,مدیر مهندسی کیفیت,1
2021,فروش لباس زنانه,5
2022,معاون تراشکاری,7
2023,کارشناس ارشد اعتباری,2
2024,کارشناس ارشد الکترونیک,2
2025,مسئول توزین موادریزوحمل,4
2026,کارشناس ارزشیابی و امور گواهینامه ها,2
2027,کارگرفنی تولیددرپست کارگرمونتاژمقره نصب مل,8
2028,کارگرمخلوطکن اسپردینگ,8
2029,اجر چین کوره,7
2030,تعمیرات وفنی,7
2031,تعمیرکار تاسیسات مکانیکی,7
2032,تکنسین خدمات فنی پ ژت,3
2033,ذیحساب گمرکات استان خوزستان,1
2034,رئیس آزمایشگاه های سبا,1
2035,جوشکار اسکلت بند,7
2036,سرشیفت برق و الکترونیک,3
2037,سرپرست قالبسازی اشپرتیس قالبسازی,3
2038,قسمت انبارکل,4
2039,مسئول ترانسپورت صنعتی,3
2040,کارگر کارگاه شمش و برشکاری,8
2041,کارشناس امورمالی وذیحسابی,2
2042,کاردان فنی و مهندسی,3
2043,کارگرانبارقطعات یدکی کارخانه,9
2044,کارمند کنترل کیفیت,3
2045,کارگرکمکنجار,9
2046,کارگرکمکی اهنگری قدرت وشن پاش,9
2047,برقکاردیگ بخار مونتاژدیگ بخار,7
2048,تعمیرکارمرتبه الکترومکانیک,7
2049,کمک مراقبتکارتهیه شیرآهک وموادشیمیایی تغلیظ,8
2050,بناء نسوزکارکوره ها,7
2051,رئیس اداره کنترل و نگهداری کالا,1
2052,رئیس اداره کنترل کیفیت,1
2053,تکنسین بازسازی والوها,3
2054,تکنسین برق کارخانه,3
2055,رئیس گروه نظارت وپشتیبانی,1
2056,راننده اتوبوس فرودگاه,8
2057,رییس امور احیاء جنگل,1
2058,عضو هیات مدیره,1
2059,مدیر فنی و بهره برداری,1
2060,کارشناس مسئول اداره حراست,2
2061,کارشناس ارشد ژیوتکنیک,2
2062,تکنسین برق پیشگیرانه فشارقوی,3
2063,تکنسین تاسیسات اب و فاضلاب,3
2064,دست فروش لباس زنانه,9
2065,تعمیرکار ماشین آلات کشاورزی,7
2066,رئیس قالبگیری دستی تولید,3
2067,رئیس قسمت آماده سازی مواد اولیه,3
2068,رئیس قسمت پس انداز,1
2069,سرپرست پشتیبانی مکانیک,3
2070,سرپرست پشتیبانی و هماهنگی امور خرید تهران,3
2071,سرپرست چاپ و بسته بندی,3
2072,فورمن ارشد خیاطی چرمی,3
2073,سوهان کار,7
2074,متصدی کنترل لعاب,8
2075,مدل سازکارگاه ملزومات چوبی خدمات فنی,7
2076,مسئول برنامه ریزی تعمیرات و نگهداری,3
2077,کارگرکنترل قوطی,9
2078,انگشتر فروش,5
2079,اپراتور ارشد,8
2080,کمک متصدی چاپ رتاتیو,8
2081,رئیس اداره نظارت و آزمایش و تحویل دیتا,1
2082,رئیس اداره نظارت و ارزشیابی عملکرد,1
2083,تکنسین برق ابرسانی,3
2084,راننده ارشدجرثقیل,8
2085,راننده جرثقیل سقفی مونتاژدیگ بخار,8
2086,سرپرست اداره خدمات مشترکین,1
2087,رئیس حفاظت وخوردگی فلزات,1
2088,سیم کشی صنعتی,7
2089,رییس اداره نظارت و آزمایش و تحویل دیتا,1
2090,کارشناس امور مشتریان,3
2091,مدیریت املاک,1
2092,کارشناس امور تغذیه ورژیم درمانی,2
2093,مسئول شیفت درمانگاه,2
2094,انبارمواداولیه انباربهداشتی,4
2095,کارگرخدمات نیروگاه,9
2096,بسته بندمحوطه داخل قسمت بسته بندی انتی بیوتیک,9
2097,کمک انباردارمواداولیه ومحصول انبار,4
2098,رئیس بهره برداری و نت آهک,1
2099,راننده وسایل نقلیه فوق سنگین و ویژه,8
2100,سرپرست انتظانات,5
2101,سرپرست بازرسی و تست فولاد سازی فولاد سازی کنترل کیفیت,3
2102,سرپرست برنامه ریزی و پایش تولید,3
2103,عدل شکن ماشین حلاجی ریسندگی,8
2104,مدیرکل دفتر آموزش,1
2105,مدیرکل دفتر مدیریت عملکرد،بازرسی و امور حقوقی,1
2106,کارگر کارخانه کاشی,9
2107,کارشناس کانونهای فرهنگی وتربیتی,2
2108,کارشناس تعمیرات ماشین آلات حساس واحدهای تولیدی,2
2109,مغازه دار فروش لوازم برقی,5
2110,مسئول فرایند های اداری,3
2111,کارشناس برنامه ریزی راهبردی و اجرایی,2
2112,کارشناس مسئول توسعه,2
2113,کشش ام ماشین کاردستگاه,8
2114,افسر شناور مسافربری,3
2115,گچکار ساختمانی,7
2116,کارگرپاکت سازی,9
2117,تزریقکار فوم,8
2118,اپراتور دستگاه روکش چوب,8
2119,اپراتور دستگاه ری بریکر ریسندگی,8
2120,اپراتور دستگاه سی ان سی عمودی شیشه,8
2121,اپراتور دستگاه چاپ تامپو,8
2122,کنترلر قفسه بافندگی,8
2123,تعمیرکاراپراتوردیزل وژنراتور,7
2124,تکنسین های الکترونیک,3
2125,تکنسین کنترل موجودی مواد و محصول,3
2126,تکنسین آبیاری,3
2127,تکنسین اتوماسیون صنعتی ناحیه نوردگرم,3
2128,تکنسین ارشد طرح و برنامه,3
2129,تکنسین انبار برنامه ریزی بخش برنامه ریزی تولید و کنترل,3
2130,سرپرست سیلندرسازی,3
2131,مدیر نورد ها,1
2132,کارشناس مسئول پرستاری منابع انسانی,2
2133,قسمت مکانیک,7
2134,معاون امورمجلس حقوقی و استانها,1
2135,مسئول خدمات و پشتیبانی,1
2136,مسئول لجستیک سا لن رنگ,3
2137,کارشناس ارشد خدمات فرودگاهی,2
2138,نقاش شیشه,7
2139,مسئول تکمیل کاری,3
2140,کمک لوله کش رفاه,9
2141,تکنسین فنی عمران وساختمان,3
2142,جوشکار در و پنجره,7
2143,رئیس تولید انرژی,1
2144,رئیس تولید خط نهایی رئیس برش,1
2145,راننده لیفتراک وکارگرانبار,8
2146,رئیس امور احیاء جنگل,1
2147,رییس واحد حقوق و دستمزد,1
2148,رئیس تصفیه آب و پساب,1
2149,مسئول امور دفتری,3
2150,رئیس تصفیه اب و پساب,1
2151,کارشناس هماهنگی نظارت وپاسخگویی به شکایات,2
2152,کاردان الکترونیک هواپیمایی,3
2153,کارشناس نهضت سوادآموزی و آموزش های داوطلبانه و واگ,2
2154,کاردان ارشد تعمیرات برق و تهویه,3
2155,کارشناس ارشد مالی رتبه سه,2
2156,کارشناس قراردادهااتصال متقابل وفناوریهای نوین,2
2157,کارشناس منابع آب,2
2158,اداره امور ناوگان اداره کل راه اهن اصفهان لکوموتیوران اصفهان,8
2159,اداره امور ناوگان اداره کل راه اهن هرمزگان بازرس فنی مقیم سیرجان,3
2160,کمک کارشناس حراست فیزیکی,3
2161,کمک کارشناس فنی ومهندسی,3
2162,تکنسین برنامه ریزی و اجرای آموزش,3
2163,تعمیرکار فنی,7
2164,فیدر اپن تاپ,8
2165,سرایدار اتاق دار,5
2166,مسئول ایمنی وبهداشت hse,3
2167,مکانیک کاردینگ وحلاجی,7
2168,کارشناس مسئول فرصت های مطالعاتی,2
2169,کارشناس تعمیرات جرثقیل های سقفی نورد گرم,2
2170,کاردانی فنی ایمنی کار و حفاظت فنی,3
2171,مکانیک پمپ و تجهیزات و دستگاهها,7
2172,کارشناس تربیت بدنی خواهران,2
2173,کارشناس تدارکات وخریدهای اضطراری,2
2174,مسئول شیفت بافندگی,3
2175,معاون اداره حفاظت محیط زیست ایوان,1
2176,متصدی پخت رنگ دامپا,8
2177,اپراتور خط اتوماتیک واس,8
2178,تراشکارتمام اتوماتیک,8
2179,تکنسین ارشد تعمیرات برق ساختمان,3
2180,خرید وفروش لوازم منزل دست دوم,5
2181,تعمیرکار تجهیزات برق و ابزار دقیق اضطراری ماشین ریخته گری,7
2182,تکنسین مکانیک تصفیه خانه شیمیایی,3
2183,رییس تولید موکت,1
2184,رییس مرکزپایگاه داده ها,1
2185,سرپرست خدمات و پشتیبانی عمومی,3
2186,سرپرست دایره حقوقی مالی اداری بخش امور مالی,3
2187,کارشناس کنترل کیفیت قطعات پوسته ای و ماهک,2
2188,کارشناس مسئول ساخت قطعات,2
2189,پزشک عمومی ارشد,2
2190,نگهبان و آتش نشان تولید,5
2191,کارشناس برنامه ریزی و قراردادها,2
2192,کارشناس برنامه ریزی و هماهنگی اصلی,2
2193,مشاور مدیرعامل در امور روابط کار,2
2194,کارشناس شعبات پشتیبانی سطح 5,2
2195,مسیول قسمت تربیت بدنی و سالن ورزشی,1
2196,کارشناس ازمایش و سنجش شبکه انتقال,2
2197,مشاورمعاون وزیر,2
2198,کارگر ارشد سرکارگر نمونه برداری معدن,3
2199,کارگر ساخنمانی,9
2200,اپراتور بلوم یارد ریخته گری مداوم فولادسازی,8
2201,اپراتور تولید مواد ناریه,8
2202,اپراتور دستگاه بافندگی محوری,8
2203,اپراتور دستگاه بسته بندی خمیردندان,8
2204,تعمیر کار مکانیکی درجه 4 نگهداری و تعمبرات ماشین آلات,7
2205,تمیزکار و سنگ زن قطعات تولیدی,9
2206,رئیس نوبتکاری تقطیر و کاهش گرانروی شماره,3
2207,رئیس پروژه های عمرانی,1
2208,سرشیفت مکانیک ماسوره پیچی,3
2209,مدیر امور مجامع و شرکتهای تابعه,1
2210,کاردان عملیات فرآوری,3
2211,مسئول خدمات رفاهی و نقلیه,1
2212,کارشناس مسئول پیشگیری ازاسیبهای اجتماعی,2
2213,متصدی کنترل توزیع برق,3
2214,اپراتور دستگاه لبه زن شیشه,8
2215,تعمیرکار پست های گاز,7
2216,رئیس اداره فرهنگی،اجتماعی و ورزشی,1
2217,سرپرست برنامه ریزی وکنترل تولید فولادسازی,3
2218,سرپرست تضفیه خانه شیمیایی,3
2219,رییس اداره انبارونگهداری کالا,1
2220,متصدی امور پرسنلی,4
2221,متصدی انبار و جابجایی قرقره های بین مراحل تولید درسالن تولید,9
2222,فرش باف,7
2223,متصدی تعمیرات ماشین آلات,7
2224,کارشناس فنی ابزی پروران,2
2225,رییس اداره نصب و مونتاژ تاسیسات الکتریکی,1
2226,مسئول تغییرات مهندسی و قطعات,2
2227,مکانیک درجه یک,7
2228,قایم مقام مدیر عامل در امور مالی و اقتصادی,1
2229,معاون امورسیاسی واجتماعی,1
2230,مکانیک جرثقیل هوایی,7
2231,متصدی کنترل دستگاه ریخته گری فلزات,8
2232,نظافتچی کلندرجدید,9
2233,کاردان فرابری داده ها,3
2234,کارگرقسمتتهیه خمیردندان کارباپودرایروزیل,8
2235,کارگرساده مونتاژکاری,8
2236,سرباز یگان ویژه,5
2237,سرپرست قطعه سازی مشعل کار,3
2238,مهندس ارشد نگهداری و تعمیرات مکانیکی,2
2239,کارشناس برنامه،بودجه وجذب منابع,2
2240,چله پیش کش بافندگی چک جدید,8
2241,مسئول مونتاژکاری و ورقکاری,3
2242,کارشناس مسئول تعمیرات ابزار دقیق,2
2243,مسئول قسمت باشگاه مشتریان,3
2244,مدیر دفتر حقوقی,1
2245,مهندس ارشد بازیابی مواد,2
2246,کارمند تضمین کیفیت,3
2247,اپراتور ماشین کاری الکتروشیمیایی فلزات,8
2248,گروه نظارت بر خط و سازه های فنی اداره کل راه اهن خراسانکارشناس نظ,2
2249,تکنسین تعمیرات تاسیسات و لوله کشی صنعتی,3
2250,رئیس حفاظت اسناد و مدارک,1
2251,سرپرست شیفت ریخته گری مداوم فولادسازی,3
2252,کاردان جمع اوری امار واطلاعات,3
2253,متصدی شوینده تفاله باگاس,8
2254,مسئول امور قراردادها و رسیدگی به بیمه شدگان,3
2255,متصدی کترینگ,5
2256,کارشناس توسعه اشتغال,2
2257,معاون اداری ومالی مرکز,1
2258,متصدی کنترل مرغوبیت داخلی,3
2259,مکانیک تعمیرات ادوات کشاورزی,7
2260,معاون تعمیرگاه مرکزی,1
2261,مکانیک سنگین,7
2262,کارشناس حسابداری ذخائر و سرمایه گذاری,2
2263,کارگرماشینکاری سطح 3 بورینگ کار,8
2264,کارگرموقت رفاه,9
2265,کمک سرپرست سرویس ونگهداری وسائط نقلیه,3
2266,اپراتور اتاق برش,8
2267,کارگرفرزکار,8
2268,تکنسین فنی رنگ مکانیزه,3
2269,ذیحساب و مدیرکل امور مالی وزارت اموزش وپرورش,1
2270,سرپرست مجموعه ورزشی,1
2271,سرپرست مدیریت تولید فرآورده های تزریقی حجیم وکارتریج,1
2272,سرشیفت کنترل مرغوبیت,3
2273,سرمکانیک ماشینهای راهسازی,7
2274,مسئول تبلیغات مراسم و بازدیدها,3
2275,متصدی اکسیژن پرکنی و مکانیک,7
2276,کارگر تخلیه شوفاژ,9
2277,متصدی بایگانی پرسنلی,4
2278,کارشناس خدمات شهرسازی,2
2279,کارشناس مسیول طرح و مهندسی سرویسهای مخابراتی,2
2280,کارگر برش فلزات,8
2281,مکانیک ریسندگی واپن اند,7
2282,کاردان امور فوق برنامه و مشاوره,3
2283,کارشناس مسیول امنیت شبکه,2
2284,منشی ارشد بخش منابع انسانی,4
2285,کارشناس حسابداری وفروش,2
2286,معاونت مدیرعامل دراموربازرگانی,1
2287,مهندس ارشد امنیت فناوری اطلاعات,2
2288,کارگراسفالتکاری,9
2289,کفش فروشی,5
2290,حسابدار درجه 3 مالی,2
2291,تکنسین دستگاه های مخابراتی,3
2292,رئیس حسابرس داخلی ج,1
2293,راننده لیفترک ریخته گری,8
2294,مسئول انبار ضایعات,4
2295,مسیول برنامه ریزی تعمیرات و نگهداری,3
2296,رییس قالبگیری دستی تولید,3
2297,کارشناس متخصص امور بیمه شدگان,2
2298,مسئول شیفت تعمیرات مکانیک ماشین آلات,3
2299,کارشناس مسؤول جمع آوری سوانح,2
2300,مهندس بهینه سازی و اصلاح قطعات,2
2301,مدیربرنامه ریزی وکنترل پروژه پروژه خاص,1
2302,کارشناس امور مالی حقوق و دستمزد,2
2303,کارگر عدلبند عدلساز بخش اکریلیک,9
2304,کارگر فنی بنا ساختمانی,7
2305,کارگرساده کارگاه مونتاژفریزر,9
2306,انباردارموادومحصول,4
2307,بنا نسوز کار,7
2308,بناء ساختمانی,7
2309,تکنسین تحقیق و توسعه,3
2310,کارشناس مکانیک ساخت داخل,2
2311,کارشناس امتحانات,2
2312,معاون مدیر امور اتباع و مهاجرین خارجی,1
2313,نگهبانی ساختمان,5
2314,کارگرکارشناسی تولیدسرشیفت سالن خط تولید,3
2315,اداره کل راه اهن اصفهان متصدی تعمیرات الکتریکی,7
2316,استادکار تراشکاری,7
2317,کارگرفنی وتعمیرکار,7
2318,کمک تکنسین برق فشارقوی,7
2319,رئیس مهندسی سیستمهای خدمات,1
2320,رئیس کارشناس اداره پشتیبانی وشبکه ترویج,2
2321,سرکارگر نمونه برداری معدن,3
2322,سرپرست برنامه ریزی تعمیرات اساسی,3
2323,سرپرست برنامه ریزی کالا و کنترل مصارف,3
2324,مدیر قراردادهای خرید,1
2325,کارشناس مسئول سنجش,2
2326,کارشناس خدمات تورگردی,3
2327,کاردان خرید ماشین آلات قطعات و تجهیزات مکانیکی,3
2328,پلیسه گیر و تمیز کار,9
2329,کارگرتولیدی کارخانه قالی بافندگی مقدمات,8
2330,کارگرجمع آوری تخم مرغ,9
2331,اپراتور دستگاه پرس وکیوم چوب,8
2332,کنترلرنهایی لامپ معمولی,8
2333,کارگرمکانیک و جوشکار,7
2334,تکنسین پذیرش و بررسی مدارک پزشکی,3
2335,تکنسین پرورش جنگل,3
2336,تکنسین ابزارسازی,3
2337,رئیس اداره فرهنگ و ارشاد اسلامی شهرستان مه ولات,1
2338,کارگرخدمات وحمل ونقل بافندگی,9
2339,اپراتور دستگاه روکش هایگلاس چوب,8
2340,اپراتور دستگاه پوشش دهنده چرم و دباغی,8
2341,کارگرنجاری,7
2342,اپراتور پرکنی کپسول غیر آنتی بیوتیکی,8
2343,برشکار درجه دو,7
2344,رئیس اداره داروودرمان وازمایشگاهها,1
2345,تکنسین آزمایشگاه کنترل حین تولید,3
2346,ریسنده درجه و کارگردولاتاب,8
2347,راننده حمل زباله,8
2348,روزنامه فروش دوره گرد,9
2349,سرگروه تعمیرات خودرو ق,7
2350,مسیول دفتر تدارکات و پیگیری اسناد,4
2351,کارشناس تعمیرات برق و اتوماسیون وابراردقیق ناحیه فولادسازی و,2
2352,مسیول بهره برداری تصفیه خانه و آزمایشگاه,3
2353,کاردان یا تکنسین امورداروئی انباردار داروئی,3
2354,کارشناس کنترل برنامه های استراتژیک,2
2355,کارگردوماشین دورنگ,8
2356,کارگرساده تولیدف,9
2357,آسیاب آهک,8
2358,تاسیسات کار درجه 2,7
2359,تکنسین آزمایشگاه امور فنی و اجرایی,3
2360,تکنسین ارشد آنالایزر ابزاردقیق,3
2361,خواندن کنتور برق,9
2362,تعمیرکار تجهیزات سیستمهای پرتوزا نوبتکار,7
2363,رئیس امور فرهنگی و اجتماعی,1
2364,رئیس تجزیه مبادلات,1
2365,راننده ماشین آتشنشانی,8
2366,سرپرست بررسی شکایات مشتریان,3
2367,نگهبان ارشد,5
2368,کارشناس ایزولاسیون,2
2369,کارشناس ایمنی و تحلیل خطرات,2
2370,کا رشناس تجارت خارجی,2
2371,کارشناس انبار کشاورزی,2
2372,کارشناس اویونیک سطح 2,2
2373,کاردان سخت افزار کامپیوتر,3
2374,کارشناس دفترفنی,2
2375,کارمندارشدحسابداری صنعتی,4
2376,کارگر,9
2377,کارگرتعمیرات سیستمهای برق فشارقوی,7
2378,استادکار جوشکار اسکلت فلزی,7
2379,کارمندارشدترخیص کالادرجه,3
2380,کارشناس ایمنی و بهداشتکار,2
2381,متصدی دوشیشه شربت پرکنی خط,8
2382,نگهبانی ازشرکت,5
2383,کارشناس روابط عمومی و شبکه های مجازی,2
2384,کارشناس روش دستگاهی,2
2385,معاون سرمکانسین,7
2386,مدیر برنامه ریزی و بهبود فرآیندهای بازاریابی و فروش,1
2387,مدیر امور نگهداری و تعمیرات مخابرات و تله متری,1
2388,کارشناس فنی ساختمان,2
2389,کارگرنظافتچی وحمل ضایعات,9
2390,اپراتور دستگاه آسیاب چوب,8
2391,اداره سیر و حرکت اداره کل راه اهن شمالشرق رئیس قطار باری,5
2392,رئیس سالن مکمل,3
2393,رئیس فروش و وصول مطالبات,1
2394,رییس تعمیرات الکترونیکی,1
2395,رییس تعمیرات ونگهداری واحد انفرادی,1
2396,رییس دایره تولیدشکر,1
2397,کارشناس مسئول طرح و مهندسی سرویسهای مخابراتی,2
2398,مسئول دفتر تدارکات و پیگیری اسناد,4
2399,سرپرست تولید و بهره وری شکر زرد,3
2400,سرپرست کیفیت قطعات فلزی,3
2401,مسئول استخدام و خدمات اداری,2
2402,کارمند برنامه ریزی مواد سطح 3,4
2403,مسئول ارسال محصولات,4
2404,مسئول رنگ و هنگر سوز,3
2405,مسئول خرید مواد افزودنی و فروآلیاژها,3
2406,کارشناس بررسی طرحهاوبراوردتجهیزات,2
2407,کارگرانباراکتشافات آب,9
2408,کاشت گندم وجو,6
2409,کارگرایمنی,9
2410,کارگربتن سازی,7
2411,اپراتور سازه فلزی پشتیبانی و نوسازی,8
2412,اپراتور سی ان سی,7
2413,انباردارمکانیک تعمیرگاه مرکزی,4
2414,جوشکارنیمه ساخته آبگرمکن,7
2415,رئیس اداره کنترل وهماهنگی امنیت شبکه,1
