id,title_norm,label_1,isco_sub_major_group
47194.0,مسئول دیگ بخارآهنگری,8,
47195.0,مسئول دیگ بخارتفاله سوز تصفیه اب فیزیکی,8,
47196.0,مسئول دیگ بخاروآب صنعتی,8,
47197.0,مسئول دیگ بخارپکیج,8,
47199.0,مسئول ذهتابی و دباغی,7,
47200.0,مسئول ذوب lf,8,
47201.0,مسئول ذوب کوره های پاتیلی و گاززدایی,8,
47203.0,مسئول رادیاتورسازی,7,
47204.0,مسئول رافینگ,8,
47205.0,مسئول رام راش,8,
47206.0,مسئول رانندگان +معدن,8,
47207.0,مسئول رانندگان ماشین آلات کشاوزی,8,
47209.0,مسئول راهبری tbm,8,
47210.0,مسئول راهبری مکانیزم های کارگاهی,8,
47212.0,مسئول ربا ت های سا لن رنگ,8,
47214.0,مسئول رتوش تز ئینات برق و مکا نیک قا ئم به شا غل,7,
47221.0,مسئول رزوه,7,
47226.0,مسئول رسوب گیری,8,
47252.0,مسئول رفو,7,
47254.0,مسئول رلیاژ برق,7,
47258.0,مسئول رنگ آمیزی صنعتی و ماسه زنی,7,
47259.0,مسئول رنگ آمیزی محصول,7,
47260.0,مسئول رنگ اکستریور سایت شمال,7,
47261.0,مسئول رنگ رویه و رتوش کا بین,7,
47262.0,مسئول رنگ رویه و رتوش کابین دو و رتوش موضعی,7,
47263.0,مسئول رنگ سازچاپ کلندر,7,
47264.0,مسئول رنگ سازی روتاری چاپ اسکرین,7,
47265.0,مسئول رنگ وکیلرکاری چوب,7,
47266.0,مسئول رنگرزی تکمیل کتن,7,
47267.0,مسئول رنگرزی تکمیل گردباف,7,
47269.0,مسئول رو توش,7,
47274.0,مسئول روانکاری,7,
47275.0,مسئول روتوش برق و مکا نیک,7,
47276.0,مسئول روتوش تزئینات برق و مکانیک,7,
47277.0,مسئول روتوش تزئینات رنگ وتعمیرات موضعی,7,
47278.0,مسئول روتوش و تعویض قطعات قوای محرکه و انتقال خودروها,7,
47279.0,مسئول روزمزدحمل ونقل,9,
47280.0,مسئول روزکارتعمیرات تاپس,7,
47282.0,مسئول روشنائی,7,
47283.0,مسئول روشنائی برق,7,
47284.0,مسئول روشنایی معابر,7,
47285.0,مسئول روشنایی و سیستم آلارم,7,
47286.0,مسئول روشنایی و سیستم هشدار دهنده,7,
47288.0,مسئول روغنکشی,8,
47289.0,مسئول روغنکشی پنبه دانه,8,
47290.0,مسئول رول بازکنی,8,
47291.0,مسئول رولیاژ,7,
47292.0,مسئول رولیاژ بهره برداری پست ها و شبکه ها,7,
47293.0,مسئول روکش,7,
47294.0,مسئول روکش سفالسپورین خوراکی,7,
47295.0,مسئول روکش پنی سیلین خوراکی,7,
47296.0,مسئول رویه سازی نجاری,7,
47298.0,مسئول رویه کاری,7,
47299.0,مسئول ریخت ذوب مجدد,8,
47300.0,مسئول ریخته گری برنج،ماهیچه گیری,7,
47301.0,مسئول ریل t.b.m,8,
47302.0,مسئول رینگ,8,
47303.0,مسئول رینگ ودولاتاب,8,
47304.0,مسئول ریگری,7,
47313.0,مسئول زیباسازی وتاسیسات,7,
47315.0,مسئول زیر سازی راهها,7,
47316.0,مسئول زیر پودری,8,
47320.0,مسئول زیره بری,7,
47321.0,مسئول زیره سوارکنی,7,
47322.0,مسئول زیمر,8,
47323.0,مسئول سا خت پا لت و قلاب,7,
47326.0,مسئول سا ید ها ی چپ وراست,8,
47327.0,مسئول ساخت استریل,7,
47328.0,مسئول ساخت الکترود,7,
47329.0,مسئول ساخت خمیری و آرایش,7,
47330.0,مسئول ساخت داروئی مایع,7,
47331.0,مسئول ساخت درب وپنجره آهنی,7,
47332.0,مسئول ساخت دکل و نورافکن,7,
47333.0,مسئول ساخت روغن امولسیونشونده,7,
47334.0,مسئول ساخت شوینده ها و مایعات,7,
47335.0,مسئول ساخت ظروف حساس,7,
47336.0,مسئول ساخت غیراستریل پنی سیلین وی,7,
47337.0,مسئول ساخت قالب قطعات فلزی زون,7,
47338.0,مسئول ساخت قالب قطعات پلاستیکی,7,
47339.0,مسئول ساخت قطعات اپتیکی لیزر,7,
47340.0,مسئول ساخت قطعات تولید پیگیری سفارشات,7,
47341.0,مسئول ساخت مایعات,7,
47342.0,مسئول ساخت محصول لیزر فیبری پر توان,7,
47343.0,مسئول ساخت مواد خمیری,7,
47344.0,مسئول ساخت موادخمیری ارایشی,7,
47345.0,مسئول ساخت و اتاق فرمان,8,
47346.0,مسئول ساخت و احداث ایستگاه مترو,7,
47347.0,مسئول ساخت و تعمیرات پالت,7,
47349.0,مسئول ساخت و نوسازی فیکسچر و ابزار,7,
47350.0,مسئول ساخت و نوسازی مرتبه,7,
47351.0,مسئول ساخت وما شینکاری,7,
47352.0,مسئول ساخت وچاپ بطری,7,
47353.0,مسئول ساخت ویال و آمپول,7,
47354.0,مسئول ساخت پلاسی بیس,7,
47359.0,مسئول سازنده سودسوزاور,7,
47362.0,مسئول سالن اره نواری,8,
47363.0,مسئول سالن برشکاری,8,
47364.0,مسئول سالن تکمیل,8,
47365.0,مسئول سالن ساخت شکلات,8,
47366.0,مسئول سالن ساخت پفک,8,
47367.0,مسئول سالن سازی فنی,7,
47368.0,مسئول سالن شستشوی باگاس,8,
47369.0,مسئول سالن صابون سازی وپودر,8,
47370.0,مسئول سالن طلقی,8,
47373.0,مسئول سالن لاک زنی,8,
47374.0,مسئول سالن مایعات و,8,
47375.0,مسئول سالن مقدمات,8,
47377.0,مسئول سالن پنبه پاک کنی,8,
47382.0,مسئول سالون حرارت,8,
47387.0,مسئول سانتریفیوژ,8,
47388.0,مسئول ساگار,7,
47398.0,مسئول ستر,8,
47400.0,مسئول سر ویس های اتو بوس رانی,8,
47401.0,مسئول سر ویس و تعمیرات تصفیه خا نه ها,7,
47402.0,مسئول سراجی,7,
47403.0,مسئول سربندی,7,
47404.0,مسئول سرسیلوهای سیمان,8,
47405.0,مسئول سرسیلوهای موادخام,8,
47406.0,مسئول سرمایش,7,
47407.0,مسئول سرند,8,
47410.0,مسئول سرویس خودروها گاراژ,7,
47412.0,مسئول سرویس روغن,7,
47413.0,مسئول سرویس لیفتراک,8,
47416.0,مسئول سرویس مونتاژ و تست,8,
47417.0,مسئول سرویس نگهداری بافندگی,7,
47418.0,مسئول سرویس هاوتعمیرات پمپ ها,7,
47419.0,مسئول سرویس های پسماند و پساب,8,
47420.0,مسئول سرویس و پنچرگیری,7,
47421.0,مسئول سرویس وتعمیرات دیزل,7,
47422.0,مسئول سرویس ونگهداری شبکه فشارقوی برق,7,
47423.0,مسئول سرویس ونگهداری کمپرسورها,7,
47425.0,مسئول سرویسکار سالن استرچ,7,
47426.0,مسئول سرویسکاری وآپاراتی,7,
47428.0,مسئول سریکاری و cnc,7,
47435.0,مسئول سفیدگری قدیم رنگرزی,7,
47440.0,مسئول سمباده کار,7,
47444.0,مسئول سنباده,7,
47445.0,مسئول سنباده زنی,7,
47446.0,مسئول سنجاق زنی,8,
47449.0,مسئول سند بلاست و رنگ,7,
47451.0,مسئول سنگ آهک وکنترل بونکر,8,
47452.0,مسئول سنگ شکن وبتون ساز,7,
47453.0,مسئول سنگزنی ودریافت توزیع قطعات تولیدی,7,
47457.0,مسئول سوخت رسانی,8,
47458.0,مسئول سوخت ومازوتخانه,8,
47459.0,مسئول سوراخکاری,7,
47461.0,مسئول سپراتور,8,
47462.0,مسئول سکو,8,
47463.0,مسئول سیالات آب و گاز,7,
47468.0,مسئول سیستم شستشو و کاتافورز,8,
47476.0,مسئول سیستم های فشرده,8,
47484.0,مسئول سیستم هوای فشرده کمپرسور,8,
47498.0,مسئول سیلرزنی دو,7,
47499.0,مسئول سیلرکاری,7,
47500.0,مسئول سیلندر پرکنی,8,
47501.0,مسئول سیلندرسازی وآبکاری,7,
47502.0,مسئول سیلندرپرکنی واحدeo,8,
47503.0,مسئول سیلو ر,8,
47504.0,مسئول سیلوخمیرزنی,8,
47505.0,مسئول سیلوی روباز,8,
47506.0,مسئول سیلوی فلزی,8,
47507.0,مسئول سیلوی مواد,8,
47508.0,مسئول سیلوی گندم,8,
47509.0,مسئول سیلک,7,
47510.0,مسئول سیم سازی,7,
47511.0,مسئول سیم پیچی,7,
47512.0,مسئول سیم پیچی موتورها,7,
47513.0,مسئول سیمهاوپایه هاخط هوائی ژ باقفلیها,7,
47516.0,مسئول سیکلونها,8,
47517.0,مسئول سیگنالینگ,8,
47519.0,مسئول شارژ اکسیژن,8,
47520.0,مسئول شارژ تغذیه کوره,8,
47521.0,مسئول شارژ کوره ها,8,
47522.0,مسئول شارژ کوره ها ریخته گری,8,
47523.0,مسئول شارژذوب,8,
47524.0,مسئول شارژوچوپ خردکنی,8,
47525.0,مسئول شاسی سازی کمپ,7,
47526.0,مسئول شاسی سنگین,7,
47527.0,مسئول شاسی مکانیک,7,
47528.0,مسئول شاسی و زیربندی,7,
47529.0,مسئول شاقوکاری کوره های بخاروآهک,7,
47530.0,مسئول شانتینگ یارد,8,
47531.0,مسئول شانه سازی,7,
47546.0,مسئول شتتشو و رنگ آستری,7,
47547.0,مسئول شتشو,9,
47548.0,مسئول شستشو و رنگ,7,
47549.0,مسئول شستشو و پرکنی,8,
47550.0,مسئول شستشو والکتروفر وز,7,
47551.0,مسئول شستشولعاب,7,
47552.0,مسئول شستشوی تفاله,9,
47553.0,مسئول شستشوی موتوروزنگزدائی وروغنکاری,7,
47554.0,مسئول شستشوی کوئل,7,
47555.0,مسئول شستو,9,
47557.0,مسئول شعبه اتصال کولر,7,
47559.0,مسئول شعبه بخاری,7,
47569.0,مسئول شعبه تغلیظ و آهک,8,
47570.0,مسئول شعبه شستشوی فسفاته,7,
47571.0,مسئول شعبه صافکاری رنگ,7,
47575.0,مسئول شعبه نجاری,7,
47577.0,مسئول شفت اسپلایسر,7,
47589.0,مسئول شوینده,7,
47590.0,مسئول شکل دهی آجر,7,
47591.0,مسئول شیب و شیو,9,
47592.0,مسئول شیرآلات,7,
47594.0,مسئول شیف ت مکانیزه,8,
47595.0,مسئول شیفت b.m.d,8,
47596.0,مسئول شیفت cam,8,
47598.0,مسئول شیفت mv hv,8,
47599.0,مسئول شیفت ro,8,
47600.0,مسئول شیفت آبرسانی و فاضلاب صنعتی,8,
47603.0,مسئول شیفت آسیاب خاک خط,8,
47604.0,مسئول شیفت آماده سازی تختال,8,
47605.0,مسئول شیفت آماده سازی زغال,8,
47606.0,مسئول شیفت آماده سازی و ذوب ریزی کاردان تولید,8,
47607.0,مسئول شیفت آماده سازی گاید و مونتاژ,8,
47608.0,مسئول شیفت آهک وآهک هیدراته,8,
47609.0,مسئول شیفت اببندی قالب,7,
47610.0,مسئول شیفت اتصالات,8,
47613.0,مسئول شیفت اردسازی وبوجاری و گندم شویی,8,
47614.0,مسئول شیفت ارسال پاتیل,8,
47615.0,مسئول شیفت استخراج نعمت,8,
47616.0,مسئول شیفت اسکین پاس,8,
47617.0,مسئول شیفت الومایت,8,
47619.0,مسئول شیفت الیاژسازی ریخته گری,8,
47624.0,مسئول شیفت انباشت و بارگیری کنسانتره,8,
47625.0,مسئول شیفت انباشت وبرداشت نورد پیوسته,8,
47627.0,مسئول شیفت انرژی,8,
47628.0,مسئول شیفت اوابراسیون,8,
47630.0,مسئول شیفت اکسترودر,8,
47631.0,مسئول شیفت اکسید روی,8,
47632.0,مسئول شیفت ایزوگام,7,
47633.0,مسئول شیفت ایستگاه پمپاژ باطله,8,
47634.0,مسئول شیفت بارگیرخانه خ,8,
47637.0,مسئول شیفت بازپخت هیدروژنی و شستشوی الکترولیتی,8,
47638.0,مسئول شیفت بازیابی,8,
47639.0,مسئول شیفت بازیافت حلالهای صنعتی,8,
47640.0,مسئول شیفت باکس آنیلینگ و بازپخت هیدروژنی,8,
47641.0,مسئول شیفت برق رنگرزی متراژ دوزندگی,7,
47647.0,مسئول شیفت بسته بندی مایعات پاک کننده,8,
47648.0,مسئول شیفت بلوئینگ,8,
47649.0,مسئول شیفت بهره برداری توزیع سیالات,8,
47650.0,مسئول شیفت بهره برداری پساب صنعتی و ro2,8,
47651.0,مسئول شیفت بهره برداری گازهای صنعتی,8,
47652.0,مسئول شیفت بهره بردای ro1,8,
47653.0,مسئول شیفت بهسازذوب,8,
47654.0,مسئول شیفت بورینگ وفرز,7,
47655.0,مسئول شیفت بیدوایر,8,
47656.0,مسئول شیفت تارسازی اکریلیک,8,
47657.0,مسئول شیفت تامین مواد سرد کنورتر,8,
47658.0,مسئول شیفت تاندم میل,8,
47662.0,مسئول شیفت تخلیه سیلو,8,
47663.0,مسئول شیفت تزریقی,8,
47664.0,مسئول شیفت تصفیه آبها و توزیع سیالات فولادسازی ونوردپیوسته,8,
47665.0,مسئول شیفت تعمیرات اضطراری خطوط,7,
47666.0,مسئول شیفت تعمیرات اضطراری عملیات ثانویه,7,
47667.0,مسئول شیفت تعمیرات اضطراری کوره های قوس الکتریکی وواحدهای جن,7,
47668.0,مسئول شیفت تعمیرات روشنایی و کابل,7,
47669.0,مسئول شیفت تعمیرات مدارماسه,7,
47670.0,مسئول شیفت تعمیرات مکانیکی کاغذ,7,
47671.0,مسئول شیفت تعمیرات گرم و اسلاید گیت پاتیل,7,
47672.0,مسئول شیفت تعمیرونگهداری,7,
47673.0,مسئول شیفت تقطیر گلیسرین,8,
47674.0,مسئول شیفت تمپر میل,8,
47675.0,مسئول شیفت تهویه ها,8,
47676.0,مسئول شیفت توربینهادیزل ژنراتور وتعمیرات,7,
47677.0,مسئول شیفت توزیع نیرو,8,
47678.0,مسئول شیفت توزین,8,
47679.0,مسئول شیفت تولید اسفنج فشرده,8,
47680.0,مسئول شیفت تولید انرژی و سیالات,8,
47681.0,مسئول شیفت تولید تیوبینگ,8,
47682.0,مسئول شیفت تولید سایر خطوط,8,
47683.0,مسئول شیفت تولید ضد عفونی کننده,8,
47684.0,مسئول شیفت تولید ماشینکاری چدن,7,
47685.0,مسئول شیفت تولید مایعات خوراکی,8,
47686.0,مسئول شیفت تولید نیستاتین,8,
47687.0,مسئول شیفت تولید همودیالیز,8,
47688.0,مسئول شیفت تولید و تعمیرات گالوانیزه و ورق رنگی,7,
47689.0,مسئول شیفت تولید پنل,8,
47690.0,مسئول شیفت تولید کوپلینگ,8,
47691.0,مسئول شیفت تولید گازرسانی,8,
47692.0,مسئول شیفت تولید گچ,7,
47693.0,مسئول شیفت تولیدآبرسانی فولادسازی دو,8,
47694.0,مسئول شیفت تولیدآبرسانی مرکزی,8,
47695.0,مسئول شیفت تولیدشبکه,8,
47696.0,مسئول شیفت تولیدصابون توالت,8,
47697.0,مسئول شیفت تولیدفیلامنت,8,
47698.0,مسئول شیفت تکمیل اتصالات ریخته گری,7,
47699.0,مسئول شیفت جبرانساز کوره,8,
47702.0,مسئول شیفت حمل قراضه,8,
47703.0,مسئول شیفت حمل وفرآوری سرباره,8,
47704.0,مسئول شیفت حمل ونقل فولادسازی و نورد پیوسته سبا,8,
47705.0,مسئول شیفت خط راپ وی,8,
47706.0,مسئول شیفت خط صابون ارایش,8,
47707.0,مسئول شیفت خط فرمینگ و پرس,8,
47708.0,مسئول شیفت خط لعاب,8,
47709.0,مسئول شیفت خطقالب گیری,8,
47710.0,مسئول شیفت خطوط آنیلینگ و شستشو,8,
47711.0,مسئول شیفت خطوط دیزا,8,
47712.0,مسئول شیفت خنثی سازی,8,
47713.0,مسئول شیفت دانلپ,8,
47714.0,مسئول شیفت دانه پاکنی,8,
47717.0,مسئول شیفت دستگاه تولیدگازدی اکسیدکربن,8,
47718.0,مسئول شیفت دستگاه کارخانه گاز,8,
47719.0,مسئول شیفت دستگاه گازسی او,8,
47720.0,مسئول شیفت دوم با زسازی قطعات,7,
47721.0,مسئول شیفت دوم تا سیسات,7,
47722.0,مسئول شیفت دکانتور و صافی گل,8,
47724.0,مسئول شیفت دیفوزیون,8,
47725.0,مسئول شیفت ذوب و ریخته گری آلومینیوم,7,
47726.0,مسئول شیفت راهبری جرثقیلها و ترانسفرکارها,8,
47727.0,مسئول شیفت راهبری و تعمیرات اضطراری جرثقیلهای سقفی,7,
47728.0,مسئول شیفت ریخته گری مداوم فولادسازی,7,
47729.0,مسئول شیفت ریسندگی الیاف بلند,8,
47730.0,مسئول شیفت ریسندگی پشم,8,
47731.0,مسئول شیفت ساتراسیون,8,
47732.0,مسئول شیفت سد باطله وبازیافت آب,8,
47734.0,مسئول شیفت سرویس پاتیل,8,
47735.0,مسئول شیفت سرویسهای بهداشتی عمومی,9,
47737.0,مسئول شیفت سودسازی,8,
47738.0,مسئول شیفت سولفوناسیون,8,
47739.0,مسئول شیفت سیلندرسازی کمک سرپرست,8,
47740.0,مسئول شیفت شب هلیوگراور,7,
47741.0,مسئول شیفت شبکه و پست ها,7,
47742.0,مسئول شیفت شیشه سه لایی,7,
47743.0,مسئول شیفت شیشه نشکن اتومبیل,7,
47744.0,مسئول شیفت شیشه نشکن ساختمان,7,
47746.0,مسئول شیفت صافی پرس و دکانتور,8,
47747.0,مسئول شیفت صنایع مکانیک وبرق بنبوری,7,
47748.0,مسئول شیفت طاقه کنی طاقه کنی,8,
47749.0,مسئول شیفت عملیات آبگیری کنسانتره,8,
47750.0,مسئول شیفت عملیات الکترووینینگ,8,
47751.0,مسئول شیفت عملیات اکسیژن و نیتروژن,8,
47752.0,مسئول شیفت عملیات تیکنر,8,
47753.0,مسئول شیفت عملیات دستگاه بارگیری,8,
47754.0,مسئول شیفت عملیات و تعمیرات بالابر,7,
47755.0,مسئول شیفت عملیات و تعمیرات پمپخانه,7,
47756.0,مسئول شیفت عملیات کنورتر,8,
47757.0,مسئول شیفت فرز بورینگ دریل,7,
47758.0,مسئول شیفت فیلتر ممبران,8,
47759.0,مسئول شیفت فیلم و چاپ,7,
47760.0,مسئول شیفت قسمتهاوتابگیرها,8,
47761.0,مسئول شیفت قلع ااندود و خطوط برش و انبار,8,
47762.0,مسئول شیفت لاور,8,
47763.0,مسئول شیفت لاین,8,
47764.0,مسئول شیفت لمینت,7,
47765.0,مسئول شیفت مارگارین,8,
47766.0,مسئول شیفت ماسه,8,
47767.0,مسئول شیفت ماهیچه گیری,7,
47768.0,مسئول شیفت مجموعه سازی دستی جنوبی زون,8,
47769.0,مسئول شیفت مجموعه سازی دستی شمالی,8,
47770.0,مسئول شیفت محصولات نیمه ساخته,8,
47771.0,مسئول شیفت محوطه استوک یارد,9,
47772.0,مسئول شیفت محوطه سنگ آهن وگندله,9,
47773.0,مسئول شیفت مغزگیری و ذخیره سازی,8,
47774.0,مسئول شیفت مکانیزمهای خاص,7,
47775.0,مسئول شیفت مکانیزمهای عمومی,7,
47776.0,مسئول شیفت مکانیک سالن های تولید bopet,7,
47777.0,مسئول شیفت مکانیک سالن های تولید bopp cpp,7,
47778.0,مسئول شیفت مکانیک کوره و تاسیسات,7,
47779.0,مسئول شیفت مگاه مدول احیاء مستقیم,8,
47780.0,مسئول شیفت میکسر,8,
47781.0,مسئول شیفت نجاری درجه 2,7,
47782.0,مسئول شیفت نوارسازی,8,
47783.0,مسئول شیفت نوارکلینکر,8,
47784.0,مسئول شیفت نوسازی,7,
47785.0,مسئول شیفت واحد اکسیژن فولادسازی ونوردپیوسته,8,
47786.0,مسئول شیفت واحد اکسیژن و هیدروژن,8,
47787.0,مسئول شیفت ومیکسچروموادرسانی,8,
47788.0,مسئول شیفت پارابولیک,8,
47789.0,مسئول شیفت پرس و عدلبندی,8,
47790.0,مسئول شیفت پرسکاری رباتیک,8,
47791.0,مسئول شیفت پروفایلینگ,8,
47792.0,مسئول شیفت پست برق 400kv,7,
47793.0,مسئول شیفت پست برق kv400,7,
47794.0,مسئول شیفت پمپ خانه مرکزی,8,
47795.0,مسئول شیفت پودرسازی,8,
47796.0,مسئول شیفت پولماکس,8,
47797.0,مسئول شیفت پیت زدائی,8,
47798.0,مسئول شیفت چیلرخانه و سایر سیستمهای تهویه,7,
47799.0,مسئول شیفت کارگاه نئوپان,7,
47800.0,مسئول شیفت کاموانیزه,8,
47801.0,مسئول شیفت کرمگن,8,
47802.0,مسئول شیفت کلندر,8,
47803.0,مسئول شیفت کلندروسرپرست شیفت تولید,8,
47804.0,مسئول شیفت کله زنی,8,
47805.0,مسئول شیفت کلون,8,
47810.0,مسئول شیفت گالوانیزه,8,
47811.0,مسئول شیفت گروه توزینی,8,
47812.0,مسئول شیفتadاستار,8,
47813.0,مسئول شیفتتایرسازی,8,
47815.0,مسئول صابون خشک کنی,8,
47817.0,مسئول صافکاری,7,
47818.0,مسئول صافکاری ونفاشی خودرو,7,
47819.0,مسئول صالح اباد,9,
47820.0,مسئول صحافی,7,
47848.0,مسئول صفحه تراش,7,
47850.0,مسئول صندلی سازی چوبی,7,
47860.0,مسئول ضربه ای,8,
47866.0,مسئول طبقات,9,
47870.0,مسئول طراح وهارنیش و پانچ بافندگی,7,
47876.0,مسئول طراحی قا لب,7,
47877.0,مسئول طراحی قلاب و پا کت,7,
47878.0,مسئول طراحی قلاب و پالت,7,
47884.0,مسئول طراحی و پانچ,7,
47887.0,مسئول طراحی وشانه سازی,7,
47888.0,مسئول طراحی وغلطک سازی ر,7,
47904.0,مسئول طلق گذاری و پودر پاک کنی,8,
47905.0,مسئول طناب گیر,9,
47906.0,مسئول عایق,7,
47907.0,مسئول عایق زیر بدنه,7,
47908.0,مسئول عایق و پلیت بندی,7,
47909.0,مسئول عدل بندی,8,
47910.0,مسئول علائم خط,8,
47911.0,مسئول عملیات آب و پساب,8,
47913.0,مسئول عملیات اجرائی پلی اتیلن,7,
47914.0,مسئول عملیات اجرایی بتنی,7,
47915.0,مسئول عملیات استریپ و استافینگ,8,
47916.0,مسئول عملیات اسفالت ترمیم وموجگیری,7,
47918.0,مسئول عملیات الکتروفیلتر,8,
47919.0,مسئول عملیات اولیه آهنگری,7,
47920.0,مسئول عملیات اکسیژن و استیلن,8,
47921.0,مسئول عملیات ایستگاههای آب بازیافتی,8,
47923.0,مسئول عملیات تحویل وبارگیری شکر,8,
47924.0,مسئول عملیات ترمینال cfs,8,
47925.0,مسئول عملیات ترمینال غیراستاندارد,8,
47927.0,مسئول عملیات جوشکاری برزینگ,7,
47928.0,مسئول عملیات حرارتی پیستون,8,
47929.0,مسئول عملیات خطاسیاب,8,
47930.0,مسئول عملیات ذوب ریخته گری وتنش زدایی,7,
47931.0,مسئول عملیات رمپ ایستگاه کوچک,8,
47932.0,مسئول عملیات ساخت وماشینکاری روتور,7,
47933.0,مسئول عملیات سد باطله,8,
47934.0,مسئول عملیات فیلتراسیون باطله,8,
47936.0,مسئول عملیات ما شینکاری,7,
47937.0,مسئول عملیات مواد شیمیایی و شیر آهک و شارژ گلوله,8,
47938.0,مسئول عملیات نهایی اولیه سبک,8,
47939.0,مسئول عملیات نوسازی تاندیش,7,
47940.0,مسئول عملیات نوسازی پاتیل,7,
47941.0,مسئول عملیات و تعمیرات فرآوری,7,
47942.0,مسئول عملیات و فوریت های برق,7,
47944.0,مسئول عملیات کالای فله,8,
47955.0,مسئول غلتک سازی تکمیل,7,
47956.0,مسئول غلطک سازی وشابلون سازی وطراحی ج,7,
47960.0,مسئول فایبرگلاس,7,
47962.0,مسئول فتیله,8,
47963.0,مسئول فرآوری,8,
47964.0,مسئول فرآوری پسماند,8,
47965.0,مسئول فرآیند بدنه دو,8,
47966.0,مسئول فرآیند خام چغندری,8,
47967.0,مسئول فرآیند مونتاژ دو,8,
47973.0,مسئول فراوری اپتیکی بلور,8,
47974.0,مسئول فراوری مواد,8,
47978.0,مسئول فرز کاری واسپارک,7,
47979.0,مسئول فرزکاری,7,
47980.0,مسئول فرسنگین,8,
47981.0,مسئول فرم دهی,7,
47982.0,مسئول فرم زنی,7,
47983.0,مسئول فرمانتر,8,
48000.0,مسئول فرچه,9,
48001.0,مسئول فضاهای عمومی تحقیقات و آزمایشگاه,9,
48002.0,مسئول فضای سبز و تنظیفات مجتمع فرهنگی و تفریحی آ,9,
48004.0,مسئول فلزکاری ونصب ترانس وسرگروه مخزن سازی دررا,7,
